{"$schema":"https://json-schema.org/draft/2020-12/schema","additionalProperties":false,"properties":{"inputs":{"additionalProperties":false,"properties":{"capture":{"additionalProperties":false,"properties":{"path":{"maxLength":1024,"minLength":1,"type":"string"},"sha256":{"pattern":"^[a-f0-9]{64}$","type":"string"}},"required":["path","sha256"],"type":"object"},"junit":{"additionalProperties":false,"properties":{"path":{"maxLength":1024,"minLength":1,"type":"string"},"sha256":{"pattern":"^[a-f0-9]{64}$","type":"string"}},"required":["path","sha256"],"type":"object"},"native_result":{"additionalProperties":false,"properties":{"path":{"maxLength":1024,"minLength":1,"type":"string"},"sha256":{"pattern":"^[a-f0-9]{64}$","type":"string"}},"required":["path","sha256"],"type":"object"},"report":{"additionalProperties":false,"properties":{"path":{"maxLength":1024,"minLength":1,"type":"string"},"sha256":{"pattern":"^[a-f0-9]{64}$","type":"string"}},"required":["path","sha256"],"type":"object"},"spec":{"additionalProperties":false,"properties":{"path":{"maxLength":1024,"minLength":1,"type":"string"},"sha256":{"pattern":"^[a-f0-9]{64}$","type":"string"}},"required":["path","sha256"],"type":"object"}},"required":["report","spec","capture","native_result","junit"],"type":"object"},"native_exit_code":{"enum":[0,3],"type":"integer"},"schema_version":{"const":"embedded-hil-runner.waveform-spec.v1"},"source_files":{"items":{"additionalProperties":false,"properties":{"name":{"maxLength":64,"type":"string"},"path":{"maxLength":1024,"minLength":1,"type":"string"},"sha256":{"pattern":"^[a-f0-9]{64}$","type":"string"}},"required":["name","path","sha256"],"type":"object"},"maxItems":1614,"type":"array"}},"required":["schema_version","native_exit_code","inputs","source_files"],"type":"object"}
