{"inputs":{"capture":{"path":"capture.json","sha256":"e6617918a971a9e2289a73ee9825c950fa08045cfed14938a5dd8ed6dad3a300"},"junit":{"path":"junit.xml","sha256":"3f06bb680b75714ce0826aee4e5c643d2d6db67ad4afc88fb22ef91931bf1a23"},"native_result":{"path":"native-result.json","sha256":"a2a64eaada1f95131433030e48a80848b8a3138a8727f311f714c437568be011"},"report":{"path":"report.json","sha256":"d5d245b83d37c0ea993a226b72a0512b26a48bb0cf7a159951016177e8211f29"},"spec":{"path":"spec.json","sha256":"c8e6f1f1f40b685ec51882fe945f75f2e12d2cf48e70f5c403cdecdec06961af"}},"native_exit_code":3,"schema_version":"embedded-hil-runner.waveform-spec.v1","source_files":[]}
