{"inputs":{"capture":{"path":"capture.json","sha256":"e6617918a971a9e2289a73ee9825c950fa08045cfed14938a5dd8ed6dad3a300"},"junit":{"path":"junit.xml","sha256":"8c1956988fd5687aab184002815079be91e83a3e288b18c045245d2df5b1089c"},"native_result":{"path":"native-result.json","sha256":"08049379da0681250a35d97dbd20b16a2c4bb6d988735f29a112722014a2a524"},"report":{"path":"report.json","sha256":"0d75dc0cf85e242a0ecd9cafa7a8e3fb217233e287a3657da7d4f0f4cc942b24"},"spec":{"path":"spec.json","sha256":"a395cf4412ccf3a4aa7ea8e1b06b9969caced4d1286ff50a9ab669e630a042de"}},"native_exit_code":0,"schema_version":"embedded-hil-runner.waveform-spec.v1","source_files":[]}
